{
  "$schema": "../schema/setup.schema.json",
  "schemaVersion": 1,
  "id": "html-ui-billing-onboarding",
  "formatAttribution": {
    "sources": [
      {
        "suite": "Web Content Accessibility Guidelines 2.2",
        "reference": "https://www.w3.org/TR/WCAG22/",
        "borrowed": ["semantic and perceivable interface checks", "viewport-independent usability expectations"]
      },
      {
        "suite": "Judging LLM-as-a-Judge with MT-Bench and Chatbot Arena",
        "reference": "https://arxiv.org/abs/2306.05685",
        "borrowed": ["fixed judge prompt", "structured rubric", "judge identity held constant across variants"]
      }
    ],
    "deviations": [
      {
        "difference": "The artifact is a generated local UI rather than a WCAG conformance target or conversational answer.",
        "reason": "A second visual genre tests form hierarchy, trust cues, and mobile fit without claiming accessibility certification."
      },
      {
        "difference": "One fixed jury model scores screenshots alongside deterministic markup checks.",
        "reason": "This pilot makes subjective quality measurable; later slices add human calibration and multiple blinded jurors."
      }
    ]
  },
  "task": {
    "prompt": "Create a polished, self-contained index.html for Lumen, a calm B2B SaaS billing-onboarding screen. The page title is 'Set up billing'. Show a clear three-step progress treatment for 'Company details', 'Payment method', and 'Review', with Payment method current. Include a credible payment form, billing-address choice, security/trust cue, concise order summary, Back action, and dominant 'Continue' action. It must work at 1440x1000 and 390x844, use semantic HTML, real form labels and visible focus styles, avoid horizontal overflow, use no external assets or network requests, and define a small CSS custom-property token scale for colors, spacing, and radii. Return only the complete HTML document.",
    "seedWorkspace": "benchmarks/fixtures/html-ui-billing-onboarding",
    "responseFile": "index.html",
    "taskClass": "html-ui-implementation",
    "capability": "rendered-result-quality"
  },
  "variants": [
    { "id": "terra-medium", "model": "gpt-5.6-terra", "thinkingLevel": "medium" },
    { "id": "sol-medium", "model": "gpt-5.6-sol", "thinkingLevel": "medium" },
    { "id": "sol-xhigh", "model": "gpt-5.6-sol", "thinkingLevel": "xhigh" }
  ],
  "repetitions": 1,
  "invocationTimeoutSeconds": 360,
  "successCriteria": {
    "command": "python3",
    "arguments": ["{repositoryRoot}/benchmarks/evaluators/evaluate_html_ui.py", "{workspace}", "billing-onboarding"],
    "expectedExitCode": 0,
    "timeoutSeconds": 420,
    "metricsFile": "benchmark-metrics.json",
    "primaryMetric": "qualityScore",
    "higherPrimaryMetricIsBetter": true
  },
  "costCaps": { "maxTotalTokensPerInvocation": 500000 }
}
